{
  "schema_version": "1.0.0",
  "federation_id": "FAM-CASEBRAIN",
  "generated_at": "2026-07-14T22:30:00-10:00",
  "governance": {
    "repository": "GlacierEQ/AKOS",
    "ref": "casebrain-powerup-federation-v1",
    "commit_sha": "cd9581c08952b807383590b8c409473de4bf605e",
    "path": "contracts/AKOS-FEDERATION-CONTRACT-001.md"
  },
  "truth_contract": {
    "repository": "GlacierEQ/AEON-777",
    "ref": "pull/51/head",
    "commit_sha": "df519315759c077e32de64869998d0d5983af5d4",
    "path": "BRAIN/contracts/CASEBRAIN_UNIFIED_CONTRACT.md"
  },
  "repositories": [
    {
      "canonical_id": "SYS-AKOS-001",
      "repository": "GlacierEQ/AKOS",
      "role": "federation governance, identity, lifecycle, quality gates and promotion ledger",
      "visibility": "private",
      "observed_ref": "main",
      "observed_commit": "873cc0baf86f9b72f96ebd996eb9301d05c5ee7a",
      "activation_status": "repair_proposed",
      "verification_status": "verified_files",
      "claim_boundary": "Architecture canon only; it does not establish case facts, evidence authenticity or runtime health.",
      "allowed_capabilities": ["identity", "contracts", "promotion", "quality_gates", "ledger"],
      "forbidden_capabilities": ["store_unverified_case_claims_as_fact", "file_or_serve", "self_promote_agent_output"],
      "gates": ["manifest_validation", "pro_code_review"]
    },
    {
      "canonical_id": "SYS-CASEBRAIN-AEON-001",
      "repository": "GlacierEQ/AEON-777",
      "role": "CASEBRAIN truth, provenance, validation and human-action policy layer",
      "visibility": "private",
      "observed_ref": "pull/51/head",
      "observed_commit": "df519315759c077e32de64869998d0d5983af5d4",
      "activation_status": "review_ready",
      "verification_status": "verified_files",
      "claim_boundary": "PR 51 is the reviewed contract candidate; legacy branches and narrative claims are not promoted by this registry.",
      "allowed_capabilities": ["validate_case_event", "validate_memory_record", "validate_threat_signal", "recall_index", "source_linking"],
      "forbidden_capabilities": ["production_write_before_secret_rotation", "verify_allegation_without_primary_source", "authorize_external_action", "automatic_deadline_assertion"],
      "gates": ["credential_rotation", "indexing_reconciliation", "one_audited_end_to_end_probe", "human_review"],
      "related_prs": ["https://github.com/GlacierEQ/AEON-777/pull/51"]
    },
    {
      "canonical_id": "SYS-ASPEN-CORE-001",
      "repository": "GlacierEQ/aspen-grove-core",
      "role": "constellation and canonical-resource pointer fabric",
      "visibility": "private",
      "observed_ref": "main",
      "observed_commit": "ffa67928ff673b2ff13742af010a6b99a155e3a4",
      "activation_status": "repair_required",
      "verification_status": "verified_code_inspection",
      "claim_boundary": "Pointer and projection layer only; connector presence and initialization labels are not proof of runtime health.",
      "allowed_capabilities": ["repository_pointers", "resource_pointers", "connector_health_receipts"],
      "forbidden_capabilities": ["truth_authority", "machine_local_absolute_paths", "simulated_live_status", "unsupported_savings_claims"],
      "gates": ["replace_local_paths", "receipt_backed_health", "reconcile_planned_vs_live_labels"]
    },
    {
      "canonical_id": "SYS-ASPEN-MEMORY-001",
      "repository": "GlacierEQ/aspen-grove-memory",
      "role": "memory doctrine and ranked working-view candidate",
      "visibility": "private",
      "observed_ref": "main",
      "observed_commit": "30305744b76aea21275b6492d38f4f1878aae94c",
      "activation_status": "contract_pending",
      "verification_status": "verified_repo_metadata",
      "claim_boundary": "Memory outputs remain working views until CASEBRAIN validation and human promotion.",
      "allowed_capabilities": ["distillation_candidate", "ranking_candidate", "memory_policy"],
      "forbidden_capabilities": ["silent_deletion", "fact_promotion", "original_evidence_replacement"],
      "gates": ["adoption_manifest", "deletion_review", "casebrain_envelope"]
    },
    {
      "canonical_id": "SYS-ASPEN-EVIDENCE-001",
      "repository": "GlacierEQ/aspen-grove-evidence",
      "role": "evidence processing candidate and exhibit working views",
      "visibility": "private",
      "observed_ref": "main",
      "observed_commit": "f8556f5a9a4092e617fe00010465b968ce756001",
      "activation_status": "contract_pending",
      "verification_status": "inferred_role",
      "claim_boundary": "Repository naming and README claims do not prove evidence completeness, hash integrity or chain of custody.",
      "allowed_capabilities": ["hashing_candidate", "bates_working_view", "exhibit_catalog_candidate"],
      "forbidden_capabilities": ["mutate_original_evidence", "release_evidence", "certify_chain_of_custody_without_receipts"],
      "gates": ["source_hash_required", "chain_of_custody_review", "read_only_adapter"]
    },
    {
      "canonical_id": "SYS-ASPEN-LEGAL-001",
      "repository": "GlacierEQ/aspen-grove-legal",
      "role": "legal research and template library candidate",
      "visibility": "private",
      "observed_ref": "main",
      "observed_commit": "db2df516b0b782d54c1a9882e1048938a845be35",
      "activation_status": "quarantined",
      "verification_status": "inferred_role",
      "claim_boundary": "Legal theories, templates and labels are research material, not court findings or verified applicability.",
      "allowed_capabilities": ["research_candidate", "template_candidate"],
      "forbidden_capabilities": ["legal_conclusion_as_fact", "automatic_filing", "automatic_service", "threat_escalation"],
      "gates": ["citation_check", "jurisdiction_check", "attorney_or_operator_review"]
    },
    {
      "canonical_id": "SYS-ASPEN-SUPABASE-001",
      "repository": "GlacierEQ/aspen-grove-supabase",
      "role": "optional query and projection store after security hardening",
      "visibility": "private",
      "observed_ref": "main",
      "observed_commit": "12b529fd5fe4418ed1ebd83c0e6671a7e1a62890",
      "activation_status": "blocked",
      "verification_status": "verified_code_inspection",
      "claim_boundary": "Current policies do not provide safe case isolation and current memory/evidence functions do not enforce full provenance.",
      "allowed_capabilities": ["hardened_staging_projection_after_review"],
      "forbidden_capabilities": ["production_case_data", "service_role_in_ui_or_mcp", "allow_all_rls", "unhashed_evidence_log"],
      "gates": ["case_scoped_rls", "operator_binding", "full_sha256", "append_only_audit", "staging_probe"]
    },
    {
      "canonical_id": "SYS-ASPEN-SWARM-001",
      "repository": "GlacierEQ/aspen-grove-swarm",
      "role": "parallel worker topology candidate",
      "visibility": "private",
      "observed_ref": "main",
      "observed_commit": "ab10c1fa2665a52cd400c080b8827fe862bdaa98",
      "activation_status": "contract_pending",
      "verification_status": "inferred_role",
      "claim_boundary": "Swarm labels do not prove deployed workers, persistent state or safe tool bindings.",
      "allowed_capabilities": ["parallel_read_only_analysis_candidate"],
      "forbidden_capabilities": ["unbounded_tools", "persistent_live_claim_without_receipt", "external_action"],
      "gates": ["worker_dispatch_contract", "run_receipt", "kill_switch"]
    },
    {
      "canonical_id": "SYS-ASPEN-CONNECTORS-001",
      "repository": "GlacierEQ/aspen-grove-connectors",
      "role": "connector registry and health-probe candidate",
      "visibility": "private",
      "observed_ref": "main",
      "observed_commit": "d48f28754eb663ed0721ddabf2ef9b1807e882d6",
      "activation_status": "contract_pending",
      "verification_status": "inferred_role",
      "claim_boundary": "A configured connector is not active until a dated, receipt-backed least-privilege probe passes.",
      "allowed_capabilities": ["connector_catalog", "read_only_health_probe"],
      "forbidden_capabilities": ["token_disclosure", "presence_equals_health", "implicit_write_activation"],
      "gates": ["least_privilege", "dated_probe_receipt", "human_activation"]
    },
    {
      "canonical_id": "SYS-CASEBUILDER-4000-001",
      "repository": "GlacierEQ/Casebuilder4000",
      "role": "legacy evidence-processing and document-generation tool source",
      "visibility": "private",
      "observed_ref": "main",
      "observed_commit": "159715f41fca5418902a546cb50a7178d648e534",
      "activation_status": "quarantined",
      "verification_status": "verified_code_inspection",
      "claim_boundary": "Narratives, relationship matrices, confidence scores and legal conclusions are unverified projections unless independently sourced.",
      "allowed_capabilities": ["read_only_source_adapter_candidate", "pdf_processing_candidate", "transcription_candidate", "timeline_candidate"],
      "forbidden_capabilities": ["narrative_to_verified_fact", "unsupported_actor_link", "automatic_legal_action", "original_evidence_mutation"],
      "gates": ["one_hashed_source_record", "casebrain_validation", "pending_review_output"]
    },
    {
      "canonical_id": "SYS-SUPERLUMINAL-CASE-MATRIX-001",
      "repository": "GlacierEQ/SUPERLUMINAL_CASE_MATRIX",
      "role": "Casebuilder runtime, governance and operator-state integration candidate",
      "visibility": "private",
      "observed_ref": "pull/52/head",
      "observed_commit": "0584c6ef881e22bdc39d5ec0a2adbe2b66c6f008",
      "activation_status": "review_ready",
      "verification_status": "verified_files",
      "claim_boundary": "PR 51 and draft PR 52 are review candidates; repo claims of live automation are not runtime proof.",
      "allowed_capabilities": ["memory_policy_candidate", "dependency_state", "risk_state", "run_receipts", "daily_lane"],